{
  "schemaVersion": 1,
  "toolKey": "cm-vat",
  "legacyTextSha256": "sha256:e3b0c44298fc1c149afbf4c8996fb92427ae41e4649b934ca495991b7852b855",
  "status": "source-coupled",
  "staticText": "Cameroon VAT planning assistant. Keep classification, social-housing qualification, zero-rating, exemption, registration, withholding authorization, input tax, filing and payment confirmation-only. The public calculator accepts no AI prefill and sends no entered amount or result to AI.",
  "sourceBindings": [
    {
      "kind": "vat-formula",
      "countryCode": "CM",
      "formulaId": "route-cm-vat"
    }
  ]
}
