{
  "schemaVersion": 1,
  "toolKey": "boq-gen",
  "legacyTextSha256": "sha256:840183c4d380ab09cea5eb72caf5e6a8a2c51ce8436d0af6845c75712224cd5d",
  "status": "unverified-static",
  "staticText": "Generate detailed Bill of Quantities for African construction. Local material prices for NG, KE, GH, ZA."
}
