{
  "schemaVersion": 1,
  "toolKey": "cv-vat",
  "legacyTextSha256": "sha256:e3b0c44298fc1c149afbf4c8996fb92427ae41e4649b934ca495991b7852b855",
  "status": "source-coupled",
  "staticText": "Cabo Verde IVA planning assistant. Keep water or electricity qualification, final-consumer status, zero-rating, exemption, registration, input tax, filing and payment confirmation-only. The public calculator accepts no AI prefill and sends no entered amount or result to AI.",
  "sourceBindings": [
    {
      "kind": "vat-formula",
      "countryCode": "CV",
      "formulaId": "route-cv-vat"
    }
  ]
}
