{
  "schemaVersion": 1,
  "toolKey": "td-vat",
  "legacyTextSha256": "sha256:e3b0c44298fc1c149afbf4c8996fb92427ae41e4649b934ca495991b7852b855",
  "status": "source-coupled",
  "staticText": "Chad TVA planning assistant. Keep statutory supply evidence, exemptions, annual regime screening, confirmed IGL status, the current single-operation override, statutory rounding, input tax, filing and remittance confirmation-only. The public calculator accepts no AI prefill and sends no entered amount or result to AI.",
  "sourceBindings": [
    {
      "kind": "vat-formula",
      "countryCode": "TD",
      "formulaId": "route-td-vat"
    }
  ]
}
