{
  "schemaVersion": 1,
  "toolKey": "tz-vat",
  "legacyTextSha256": "sha256:3ab60733cf3e21e3b7352f2d8b8ecca6c9a931d68e168d335880c4c2b2799b0c",
  "status": "source-coupled",
  "staticText": "Tanzania VAT expert. Zero-rated: exports, safari/tourism. Exempt: unprocessed food, educational services, financial services, medical.",
  "sourceBindings": [
    {
      "kind": "vat-formula",
      "countryCode": "TZ",
      "formulaId": "route-tz-vat"
    }
  ]
}
