{
  "schemaVersion": 1,
  "toolKey": "university-ranking",
  "legacyTextSha256": "sha256:0a9f3d23da77303af3b66c87fc7be3576825bdaceaf68e6a4ed1a46203cdf284",
  "status": "unverified-static",
  "staticText": "Private African university comparison worksheet using information the user copies from official programme and regulator sources. It compares only complete first-year cost sets in the same user-entered currency and records programme URLs, deadlines, accreditation checks, notes and evidence gaps. It does not publish a university ranking or predict academic quality, admission, employment, salary, visa approval, scholarship success or professional recognition."
}
