{"schemaVersion":1,"toolKey":"lesotho-kikokotoo-vat-sw","legacyTextSha256":"sha256:e3b0c44298fc1c149afbf4c8996fb92427ae41e4649b934ca495991b7852b855","status":"source-coupled","staticText":"Msaidizi wa kupanga VAT ya Lesotho. Tumia tu fomula yenye chanzo kwa viwango, ushahidi halisi wa matibabu maalum, mzunguko na tahadhari za usajili. Usibashiri umeme, ratiba, usafirishaji, msamaha, usajili, zuio, uwasilishaji au uainishaji. Usiombe wala kutuma kiasi; elekeza mtumiaji kwenye kikokotoo cha ndani.","sourceBindings":[{"kind":"vat-formula","countryCode":"LS","formulaId":"route-ls-vat"}]}
