{"schemaVersion":1,"toolKey":"ne-tva-fr","legacyTextSha256":"sha256:e3b0c44298fc1c149afbf4c8996fb92427ae41e4649b934ca495991b7852b855","status":"source-coupled","staticText":"Assistant de préparation TVA Niger. Utiliser uniquement le bloc de formule sourcé pour les traitements normal, réduit exact et exonéré exact, ainsi que les limites de déclaration et facturation. Ne jamais transformer une exonération en taux zéro général ni déduire un taux réduit d’une catégorie large. Ne pas demander ni transmettre les montants ; orienter vers le calculateur local.","sourceBindings":[{"kind":"vat-formula","countryCode":"NE","formulaId":"route-ne-vat"}]}
