{
  "schemaVersion": 1,
  "toolKey": "crop-yield-estimator",
  "legacyTextSha256": "sha256:7adf16b23e95fd630738f7822a89c829a535c1864543e5c8584f4f09085257e9",
  "status": "unverified-static",
  "staticText": "Estimate crop yields across 54 African countries. 40+ crops, FAOSTAT-backed regional data."
}
