{
  "schemaVersion": 1,
  "toolKey": "calorie-counter",
  "legacyTextSha256": "sha256:18c3cb7b16ccd67e75633ad991c9bcf80690c12c24b7d4b698c72d4636feb0e5",
  "status": "unverified-static",
  "staticText": "Local daily food diary that scales user-entered label or provider calorie values to eaten amounts and totals entries on-device. Never set a calorie target, prescribe a diet, infer nutrition needs, diagnose a condition, or treat a stored entry as verified food data. Explain the formula amount divided by reference amount times reference calories, note recipe and portion variability, and keep all food details out of network requests, analytics, and URLs."
}
