{
  "schemaVersion": 1,
  "toolKey": "gn-paye-fr",
  "legacyTextSha256": "sha256:f107b2688ba29a93b4125ef6bfe8e4b6c1d142fd42dde5c866f72f621d63c4ca",
  "status": "source-coupled",
  "staticText": "Expert en fiscalité guinéenne. IMPORTANT: Répondez TOUJOURS en français.",
  "sourceBindings": [
    {
      "kind": "paye-engine",
      "countryCode": "GN",
      "formulaId": "paye-server-gn"
    }
  ]
}
