{
  "schemaVersion": 1,
  "toolKey": "clinic-costs",
  "legacyTextSha256": "sha256:b04a9cdf1bc4633f1e0c3e41eb80b9e2111d456d476dcdc4063511f1a19e7ccf",
  "status": "unverified-static",
  "staticText": "Outpatient clinic budget for one initial visit plus a follow-up count selected by the user, with current provider prices, transport, extras, insurance, currency, date, and buffer. Never recommend how many visits, tests, medicines, or services are needed; never diagnose, rank clinics, or guarantee coverage. Emergency needs must be directed to urgent local care."
}
