{
  "schemaVersion": 1,
  "toolKey": "bw-paye",
  "legacyTextSha256": "sha256:fc490d964cded03f9bd24a140049a5068f5696c65fc938a08682e5d7a124585c",
  "status": "source-coupled",
  "staticText": "Botswana PAYE expert.",
  "sourceBindings": [
    {
      "kind": "paye-engine",
      "countryCode": "BW",
      "formulaId": "paye-server-bw"
    }
  ]
}
