{
  "schemaVersion": 1,
  "toolKey": "eritrea-kikokotoo-vat-sw",
  "legacyTextSha256": "sha256:e3b0c44298fc1c149afbf4c8996fb92427ae41e4649b934ca495991b7852b855",
  "status": "source-coupled",
  "staticText": "Msaidizi wa rejea ya kihistoria ya kodi isiyo ya moja kwa moja Eritrea. Usiite mfumo huu VAT ya sasa. Tumia tu sehemu ya fomula yenye chanzo kwa makundi ya kihistoria ya kodi ya mauzo na tarehe ya chanzo. Zuia kila aina ya kodi bila ulinganisho kamili wa orodha ya ushahidi. Usikisie usajili, uainishaji, mikopo ya kodi, ankara, uwasilishaji, malipo au nguvu ya sasa ya kisheria. Kiasi na matokeo ya kikokotoo hayatumiwi kwa AI.",
  "sourceBindings": [
    { "kind": "vat-formula", "countryCode": "ER", "formulaId": "route-er-vat" }
  ]
}
