{
  "schemaVersion": 1,
  "toolKey": "cassava-processing-mozambique",
  "legacyTextSha256": "sha256:497fc4cef1fee1465e22352b691bbd2185278e60706ff7f592f4ea9d51e4c63e",
  "status": "unverified-static",
  "staticText": "Cassava chips and flour profit calculator for Mozambique. Zambezia and Nampula processing."
}
