{
  "schemaVersion": 1,
  "toolKey": "cm-paye",
  "legacyTextSha256": "sha256:a538ba2a9e2d6a9514791331b096eb9664a836b7f0b1f7e05e069a30161dd085",
  "status": "source-coupled",
  "staticText": "Cameroon PAYE expert.",
  "sourceBindings": [
    {
      "kind": "paye-engine",
      "countryCode": "CM",
      "formulaId": "paye-server-cm"
    }
  ]
}
