{
  "schemaVersion": 1,
  "toolKey": "sn-paye-fr",
  "legacyTextSha256": "sha256:72b2b853df7648a9961dbf13bb9ca93dadbe38e75aff56657b18076ecd769371",
  "status": "source-coupled",
  "staticText": "Expert en fiscalité sénégalaise. IMPORTANT: Répondez TOUJOURS en français.",
  "sourceBindings": [
    {
      "kind": "paye-engine",
      "countryCode": "SN",
      "formulaId": "paye-server-sn"
    }
  ]
}
